{
  "$schema": "http://json-schema.org/draft-07/schema#",
  "$id": "https://raw.githubusercontent.com/annurdien/Kawruh/main/schemas/kerata_basa.schema.json",
  "title": "Kerata Basa Schema",
  "description": "JSON Schema for Javanese etymological philosophy (Kerata Basa/Jarwo Dosok)",
  "type": "array",
  "items": {
    "type": "object",
    "required": ["id", "category", "word", "kerata_basa", "philosophy"],
    "properties": {
      "id": {
        "type": "string",
        "description": "Unique identifier for the entry (e.g., kb_001, kb_002)",
        "pattern": "^kb_[0-9]{3}$"
      },
      "category": {
        "type": "string",
        "description": "The category of the word (e.g., Anatomi, Social, etc.)",
        "minLength": 1
      },
      "word": {
        "type": "string",
        "description": "The Javanese word being analyzed",
        "minLength": 1
      },
      "kerata_basa": {
        "type": "string",
        "description": "The etymological breakdown or acronym interpretation",
        "minLength": 1
      },
      "philosophy": {
        "type": "string",
        "description": "The philosophical meaning derived from the breakdown",
        "minLength": 1
      }
    },
    "additionalProperties": false
  },
  "minItems": 1,
  "uniqueItems": true
}
